### ISSUE TITLE
Can't find data.json on a remote server anymore

### ISSUE THREAD

**Issue by sergibondarenko** [amark/gun#465]
_gun (master branch), Node.js_ 

I have two servers, one is my laptop, another is a virtual machine (vm) on the same laptop. I see `data.json` file created on the laptop **but I don't see this file on the vm**. This worked before (approximately 1 week ago), I was able to have `data.json` files synched on both servers. 

On both servers, I run the following server code:
```
const Hapi = require('hapi');
const Inert = require('inert');
const gun = require('gun');
const pem = require('pem');

process.env.NODE_TLS_REJECT_UNAUTHORIZED = '0';
const args = process.argv.slice(2);
const mode = !args.length ? 'http' : 'https'; // http or https

const PORT = 8080;

pem.createCertificate({days: 1, selfSigned: true}, function(err, keys) {
  if (err) {
    throw err;
  }

  const server = new Hapi.Server;

  server.register(Inert, function() {
    const tls = {
      key: keys.serviceKey,
      cert: keys.certificate,
    };

    if (mode !== 'http') {
      server.connection({
        port: PORT,
        tls,
      });
    } else {
      server.connection({
        port: PORT,
      });
    }

    server.connections.forEach((c)=> gun({web: c.listener, file: 'data.json'}));

    server.route({
      method: 'GET',
      path: '/test',
      handler: function(request, reply) {
        reply('Server works!');
      },
    });

    server.route({
      method: 'GET',
      path: '/',
      handler: {
        file: './public/index.html',
      },
    });

    server.start(function(error) {
      if (error) {
        console.log(error);
      } else {
        console.log(`Server started at ${server.info.uri}`);
      }
    });
  });
});
```

On one of them I run client to put some data:
```
const Gun = require('gun');
require('gun/lib/path');
require('gun/lib/load');

process.env.NODE_TLS_REJECT_UNAUTHORIZED = '0';

const peers = [
  'https://127.0.0.1:8080/gun',
  'https://10.42.0.240:8080/gun',
];

const gun = new Gun({peers});

const trex = {
  speed: 15,
  force: 47,
};
let count = 10;

const park = gun.get('jurassic');

const delay = 0;
setTimeout(function run() {
  park.get('dinos').get('trex').put(trex, function(ack) {
    if (ack.err) {
      console.log(ack.err);
    }
    park.path('dinos').load(function(value) {
      console.log('-----------------------------');
      console.log('count: ', count++);
      console.log(value);
      setTimeout(run, delay);
    });
  });
}, delay);
```

The network connection is ok, I receive traffic from laptop on vm:
```
trex@u2:~/cluster-job-queue$ sudo tcpdump -i enp0s3 port 8080
tcpdump: verbose output suppressed, use -v or -vv for full protocol decode
listening on enp0s3, link-type EN10MB (Ethernet), capture size 262144 bytes
18:22:57.827267 IP 10.42.0.1.60762 > u2.http-alt: Flags [S], seq 672005443, win 29200, options [mss 1460,sackOK,TS val 3306379719 ecr 0,nop,wscale 7], length 0
18:22:57.827293 IP u2.http-alt > 10.42.0.1.60762: Flags [S.], seq 3045756176, ack 672005444, win 28960, options [mss 1460,sackOK,TS val 877313 ecr 3306379719,nop,wscale 7], length 0
18:22:57.827743 IP 10.42.0.1.60762 > u2.http-alt: Flags [.], ack 1, win 229, options [nop,nop,TS val 3306379719 ecr 877313], length 0
18:22:57.830310 IP 10.42.0.1.60762 > u2.http-alt: Flags [P.], seq 1:265, ack 1, win 229, options [nop,nop,TS val 3306379720 ecr 877313], leng
th 264: HTTP
18:22:57.830338 IP u2.http-alt > 10.42.0.1.60762: Flags [.], ack 265, win 235, options [nop,nop,TS val 877313 ecr 3306379720], length 0
18:22:57.830640 IP u2.http-alt > 10.42.0.1.60762: Flags [F.], seq 1, ack 265, win 235, options [nop,nop,TS val 877313 ecr 3306379720], length 0
18:22:57.833666 IP 10.42.0.1.60762 > u2.http-alt: Flags [.], ack 2, win 229, options [nop,nop,TS val 3306379721 ecr 877313], length 0
18:22:57.835836 IP 10.42.0.1.60762 > u2.http-alt: Flags [F.], seq 265, ack 2, win 229, options [nop,nop,TS val 3306379721 ecr 877313], length 0
```
